{
  "audit_id": "URPA-ZNFX1-2019-001",
  "package": {
    "title": "ZNFX1 mitochondrial dsRNA sensor (Wang, Yuan, Jia, Ge, Ling, Nie, Lan, Chen & Xu, Nature Cell Biology 21:1346-1356, 2019; DOI 10.1038/s41556-019-0416-0)",
    "scope_status": "PARTIALLY_COMPLETE",
    "scope_basis": "Package supplied to the audit contains the manuscript text plus seven author-deposited Source Data files. No analysis code, no raw instrument output, no Extended Data / Supplementary source data, and no numeric source data for Figures 4, 5 and 6 were supplied.",
    "evidence_profiles_detected": [
      "group comparisons",
      "repeated measurements or time series",
      "counted observations",
      "laboratory measurements",
      "image evidence",
      "aggregate-only evidence"
    ],
    "specialist_method_validation": "NOT_ASSESSED",
    "execution_status": "EXECUTION_NOT_ATTEMPTED",
    "execution_basis": "No analysis code, notebook, or workflow was supplied with the package, so there is nothing to execute. Independent recomputation was performed instead with deterministic scripts written by the audit and retained in audit-evidence/scripts/."
  },
  "files": [
    {
      "file_id": "FILE-0001",
      "path": "manuscript_extracted.txt",
      "classification": "NARRATIVE_OR_DOCUMENTATION",
      "readable": true,
      "bytes": 96827,
      "sha256": "9145a5dc89c2f81675b4853b872836aa38bbb35d3de5ce1ffc814956defeeb61",
      "evidence_role": "REPORTED_STATEMENT_SOURCE"
    },
    {
      "file_id": "FILE-0002",
      "path": "source-data/Source Data Fig 1.xlsx",
      "classification": "STRUCTURED_DATA",
      "readable": true,
      "bytes": 15724,
      "sha256": "948c4974e337469f85c949c69b3769a9e70f7e1602efc6e5329d0d34921a40c3",
      "evidence_role": "RESULT_OBJECT"
    },
    {
      "file_id": "FILE-0003",
      "path": "source-data/Source Data Fig 2.xlsx",
      "classification": "STRUCTURED_DATA",
      "readable": true,
      "bytes": 15179,
      "sha256": "b3f7a518a3a1ccd12d5c72a78da6f5497f876e508ca957665e142b90a6541ea1",
      "evidence_role": "RESULT_OBJECT"
    },
    {
      "file_id": "FILE-0004",
      "path": "source-data/Source Data Fig 3.xlsx",
      "classification": "STRUCTURED_DATA",
      "readable": true,
      "bytes": 12688,
      "sha256": "f77eed0f8466ebba296fdcbe13e9837133827d3883db8b28b1839582e8bc821a",
      "evidence_role": "RESULT_OBJECT"
    },
    {
      "file_id": "FILE-0005",
      "path": "source-data/Source Data Fig 4.pdf",
      "classification": "IMAGE_OR_FIGURE",
      "readable": true,
      "bytes": 19569773,
      "sha256": "5c0f777759eda96554769759498593a4b9b8578bf794081058550e24f0abf861",
      "evidence_role": "PUBLISHED_ARTIFACT_SUPPORT",
      "classification_note": "Inventory script classified by extension as NARRATIVE_OR_DOCUMENTATION; reclassified by evidence structure to IMAGE_OR_FIGURE because the file is a scan set of uncropped immunoblots with a label-only text layer."
    },
    {
      "file_id": "FILE-0006",
      "path": "source-data/Source Data Fig 5.pdf",
      "classification": "IMAGE_OR_FIGURE",
      "readable": true,
      "bytes": 13040249,
      "sha256": "6bd3c1ec2376c1fd752c694f7257abb62dc0d54affd4135e93fad43e46911e70",
      "evidence_role": "PUBLISHED_ARTIFACT_SUPPORT",
      "classification_note": "Reclassified by evidence structure as for FILE-0005."
    },
    {
      "file_id": "FILE-0007",
      "path": "source-data/Source Data Fig 6.pdf",
      "classification": "IMAGE_OR_FIGURE",
      "readable": true,
      "bytes": 6693658,
      "sha256": "f49239f09a4d8b05c01b110d8a91ea92929267914b2009b1728db5fe91c486ea",
      "evidence_role": "PUBLISHED_ARTIFACT_SUPPORT",
      "classification_note": "Reclassified by evidence structure as for FILE-0005."
    },
    {
      "file_id": "FILE-0008",
      "path": "source-data/Source Data Fig 7.xlsx",
      "classification": "STRUCTURED_DATA",
      "readable": true,
      "bytes": 16447,
      "sha256": "b4ca4c544660c71fa156231aee94da5b3ed6d5cb630563225c5f24c220ed5b09",
      "evidence_role": "RESULT_OBJECT"
    }
  ],
  "section_coverage": [
    {
      "section": "Abstract",
      "status": "REVIEWED",
      "claims_identified": 4,
      "claims_classified": 4
    },
    {
      "section": "Introduction",
      "status": "REVIEWED",
      "claims_identified": 0,
      "claims_classified": 0
    },
    {
      "section": "Results - ZNFX1 induction (Fig 1)",
      "status": "REVIEWED",
      "claims_identified": 6,
      "claims_classified": 6
    },
    {
      "section": "Results - antiviral restriction (Fig 2)",
      "status": "REVIEWED",
      "claims_identified": 4,
      "claims_classified": 4
    },
    {
      "section": "Results - in vivo (Fig 3)",
      "status": "REVIEWED",
      "claims_identified": 3,
      "claims_classified": 3
    },
    {
      "section": "Results - localisation / RNA binding / MAVS (Fig 4-6)",
      "status": "REVIEWED_EVIDENCE_BLOCKED",
      "claims_identified": 3,
      "claims_classified": 3
    },
    {
      "section": "Results - RLR independence (Fig 7)",
      "status": "REVIEWED",
      "claims_identified": 5,
      "claims_classified": 5
    },
    {
      "section": "Discussion",
      "status": "REVIEWED",
      "claims_identified": 0,
      "claims_classified": 0
    },
    {
      "section": "Methods / Statistics",
      "status": "REVIEWED",
      "claims_identified": 1,
      "claims_classified": 1
    },
    {
      "section": "Data availability",
      "status": "REVIEWED",
      "claims_identified": 1,
      "claims_classified": 1
    },
    {
      "section": "Extended Data / Supplementary",
      "status": "NOT_SUPPLIED",
      "claims_identified": 0,
      "claims_classified": 0
    }
  ],
  "studies": [
    {
      "study_id": "S-001",
      "description": "Cell-culture loss- and gain-of-function virology in A549, L929, HEK293T and MEF cells",
      "file_ids": [
        "FILE-0002",
        "FILE-0003",
        "FILE-0008"
      ]
    },
    {
      "study_id": "S-002",
      "description": "Mouse in vivo VSV/HSV-1 infection and survival",
      "file_ids": [
        "FILE-0004"
      ]
    },
    {
      "study_id": "S-003",
      "description": "Human/macaque clinical sample expression analysis (HIV, SIV encephalitis)",
      "file_ids": [
        "FILE-0002"
      ]
    },
    {
      "study_id": "S-004",
      "description": "Biochemistry: subcellular localisation, RNA binding, protein-protein interaction",
      "file_ids": [
        "FILE-0005",
        "FILE-0006",
        "FILE-0007"
      ]
    }
  ],
  "populations": [
    {
      "population_id": "P-001",
      "source_file_ids": [
        "FILE-0003"
      ],
      "unit_of_analysis": "independent experiment (biological replicate) of relative viral RNA level",
      "value_column": "Source Data Fig 2.xlsx!Sheet1 columns B-I, rows 50-52 and 57-60",
      "weight_column": null,
      "numerator": null,
      "denominator": null,
      "inclusion_rules": [
        "all deposited replicate rows within the Figure 2h block"
      ],
      "exclusion_rules": [
        "label rows 48-49 and 55-56 excluded",
        "stored p-value row 53 excluded from the input series and used only as the comparison target"
      ],
      "positive_count_requirement": null,
      "placeholder_handling": "Uninfected/control arms are deposited as the exact constant 1 in every replicate (normalisation reference), not as missing values; retained as data.",
      "missing_value_handling": "No blank cells inside the block.",
      "grouping": [
        "genotype: wt vs Znfx1-/-",
        "virus: VSV, EMCV, H1N1, HSV-1"
      ],
      "aggregation": "two-tailed unpaired Student t-test per virus, wt vs Znfx1-/-",
      "mapping_confidence": "CONFIRMED",
      "alternative_specifications_tested": [
        "Student equal-variance t-test",
        "Welch unequal-variance t-test"
      ]
    },
    {
      "population_id": "P-002",
      "source_file_ids": [
        "FILE-0004"
      ],
      "unit_of_analysis": "mouse at risk at each successive observation timepoint",
      "value_column": "Source Data Fig 3.xlsx!Sheet1!B32:C41",
      "weight_column": null,
      "numerator": "mice surviving",
      "denominator": "mice at risk at study start",
      "inclusion_rules": [
        "all 10 deposited rows for each of the two genotype columns"
      ],
      "exclusion_rules": [
        "header row 31 excluded"
      ],
      "positive_count_requirement": null,
      "placeholder_handling": "No placeholders present; all cells are small positive integers.",
      "missing_value_handling": "No missing cells.",
      "grouping": [
        "genotype: wt vs Znfx1-/-"
      ],
      "aggregation": "survival series; Gehan-Breslow-Wilcoxon per the legend",
      "mapping_confidence": "PROBABLE",
      "alternative_specifications_tested": [
        "series read as number-at-risk per timepoint (maximum 5 per group)",
        "series read as percent survival (rejected: values are integers 1-5, not a 0-100 scale)",
        "series read as two pooled cohorts of 5 to reach the legend n=10 (would require a second, undeposited cohort)"
      ]
    },
    {
      "population_id": "P-003",
      "source_file_ids": [
        "FILE-0008"
      ],
      "unit_of_analysis": "independent experiment of relative Ifnb1 / Ifit1 mRNA in Rig-I-/-;Znfx1-/- (DKO) cells",
      "value_column": "Source Data Fig 7.xlsx!Sheet1!J62:K67",
      "weight_column": null,
      "numerator": null,
      "denominator": null,
      "inclusion_rules": [
        "all deposited replicate rows in the Figure 7g block"
      ],
      "exclusion_rules": [],
      "positive_count_requirement": null,
      "placeholder_handling": "EV reference arm deposited as the exact constant 1 in all three replicates (zero variance).",